[
  {
    "source_id": "SRC-MCA-001",
    "source_title": "Ministry of Corporate Affairs — Companies Act, 2013 & LLP Act, 2008 Statutory Portals",
    "issuing_authority": "Ministry of Corporate Affairs (MCA), Government of India",
    "official_url": "https://www.mca.gov.in/",
    "source_type": "OFFICIAL_PORTAL",
    "jurisdiction": "IN-CENTRAL",
    "publication_date": "2013-08-30",
    "accessed_date": "2026-10-17",
    "last_verified_at": "2026-10-17",
    "next_review_at": "2027-04-01",
    "reliability_classification": "PRIMARY_STATUTORY",
    "access_restrictions_notes": "Official government regulatory portal. Captcha-protected forms; automated harvesting prohibited. Professional CS DSC authentication required for filing."
  },
  {
    "source_id": "SRC-CBDT-001",
    "source_title": "Income Tax Department — Income-tax Act, 1961 & E-Filing System",
    "issuing_authority": "Central Board of Direct Taxes (CBDT), Ministry of Finance",
    "official_url": "https://eportal.incometax.gov.in/",
    "source_type": "OFFICIAL_PORTAL",
    "jurisdiction": "IN-CENTRAL",
    "publication_date": "1961-09-13",
    "accessed_date": "2026-10-17",
    "last_verified_at": "2026-10-17",
    "next_review_at": "2027-04-01",
    "reliability_classification": "PRIMARY_STATUTORY",
    "access_restrictions_notes": "Taxpayer authentication and authorized ERI/GSP credentials required. Public AIS/TIS portal."
  },
  {
    "source_id": "SRC-CBIC-001",
    "source_title": "GST Network — Central Goods and Services Tax Act, 2017 & Portal",
    "issuing_authority": "Goods and Services Tax Network (GSTN) / CBIC",
    "official_url": "https://www.gst.gov.in/",
    "source_type": "OFFICIAL_PORTAL",
    "jurisdiction": "IN-CENTRAL",
    "publication_date": "2017-04-12",
    "accessed_date": "2026-10-17",
    "last_verified_at": "2026-10-17",
    "next_review_at": "2027-04-01",
    "reliability_classification": "PRIMARY_STATUTORY",
    "access_restrictions_notes": "GSP/ASP API connectivity requires licensed partner credentials. Public GSTIN verification portal."
  },
  {
    "source_id": "SRC-CGPDTM-001",
    "source_title": "Controller General of Patents, Designs and Trade Marks (IP India)",
    "issuing_authority": "Department for Promotion of Industry and Internal Trade (DPIIT)",
    "official_url": "https://ipindiaonline.gov.in/",
    "source_type": "OFFICIAL_PORTAL",
    "jurisdiction": "IN-CENTRAL",
    "publication_date": "1999-12-30",
    "accessed_date": "2026-10-17",
    "last_verified_at": "2026-10-17",
    "next_review_at": "2027-04-01",
    "reliability_classification": "PRIMARY_STATUTORY",
    "access_restrictions_notes": "Public electronic search interface for classes 1-45. Zero automated scraping permitted; manual clearance verification mandatory."
  },
  {
    "source_id": "SRC-EPFO-001",
    "source_title": "Employees' Provident Fund Organisation — Unified Shram Suvidha Portal",
    "issuing_authority": "Ministry of Labour and Employment, Government of India",
    "official_url": "https://unifiedportal-emp.epfindia.gov.in/",
    "source_type": "OFFICIAL_PORTAL",
    "jurisdiction": "IN-CENTRAL",
    "publication_date": "1952-03-04",
    "accessed_date": "2026-10-17",
    "last_verified_at": "2026-10-17",
    "next_review_at": "2027-04-01",
    "reliability_classification": "PRIMARY_STATUTORY",
    "access_restrictions_notes": "Establishment DSC / employer credentials required for ECR generation and monthly return filing."
  },
  {
    "source_id": "SRC-ESIC-001",
    "source_title": "Employees' State Insurance Corporation — Employer Portal",
    "issuing_authority": "Ministry of Labour and Employment, Government of India",
    "official_url": "https://www.esic.gov.in/",
    "source_type": "OFFICIAL_PORTAL",
    "jurisdiction": "IN-CENTRAL",
    "publication_date": "1948-04-19",
    "accessed_date": "2026-10-17",
    "last_verified_at": "2026-10-17",
    "next_review_at": "2027-04-01",
    "reliability_classification": "PRIMARY_STATUTORY",
    "access_restrictions_notes": "Employer registration and monthly contribution portal."
  },
  {
    "source_id": "SRC-RBI-001",
    "source_title": "Reserve Bank of India — FIRMS & FLAIR Reporting Systems",
    "issuing_authority": "Reserve Bank of India (RBI), Foreign Exchange Department",
    "official_url": "https://firms.rbi.org.in/",
    "source_type": "OFFICIAL_PORTAL",
    "jurisdiction": "IN-CENTRAL",
    "publication_date": "1999-12-29",
    "accessed_date": "2026-10-17",
    "last_verified_at": "2026-10-17",
    "next_review_at": "2027-04-01",
    "reliability_classification": "PRIMARY_STATUTORY",
    "access_restrictions_notes": "Entity and AD Bank two-factor authentication required for Foreign Liabilities & Assets (FLA) and FC-GPR/FC-TRS submissions."
  },
  {
    "source_id": "SRC-DPDP-001",
    "source_title": "Digital Personal Data Protection Act, 2023 & Gazette Notifications",
    "issuing_authority": "Ministry of Electronics and Information Technology (MeitY)",
    "official_url": "https://www.meity.gov.in/",
    "source_type": "REGULATORY_NOTIFICATION",
    "jurisdiction": "IN-CENTRAL",
    "publication_date": "2023-08-11",
    "accessed_date": "2026-10-17",
    "last_verified_at": "2026-10-17",
    "next_review_at": "2027-04-01",
    "reliability_classification": "OFFICIAL_GAZETTE",
    "access_restrictions_notes": "Statutory enactment defining Data Fiduciary obligations, consent frameworks, and Data Protection Board mandates."
  },
  {
    "source_id": "SRC-CERTIN-001",
    "source_title": "CERT-In Cybersecurity Directions under Section 70B of IT Act 2000",
    "issuing_authority": "Indian Computer Emergency Response Team (CERT-In)",
    "official_url": "https://www.cert-in.org.in/",
    "source_type": "REGULATORY_NOTIFICATION",
    "jurisdiction": "IN-CENTRAL",
    "publication_date": "2022-04-28",
    "accessed_date": "2026-10-17",
    "last_verified_at": "2026-10-17",
    "next_review_at": "2027-04-01",
    "reliability_classification": "REGULATORY_AGENCY",
    "access_restrictions_notes": "Mandatory 6-hour cybersecurity incident reporting window for covered corporate bodies."
  },
  {
    "source_id": "SRC-MSME-001",
    "source_title": "Ministry of MSME — Udyam Registration Portal",
    "issuing_authority": "Ministry of Micro, Small and Medium Enterprises",
    "official_url": "https://udyamregistration.gov.in/",
    "source_type": "OFFICIAL_PORTAL",
    "jurisdiction": "IN-CENTRAL",
    "publication_date": "2020-06-26",
    "accessed_date": "2026-10-17",
    "last_verified_at": "2026-10-17",
    "next_review_at": "2027-04-01",
    "reliability_classification": "PRIMARY_STATUTORY",
    "access_restrictions_notes": "Paperless official registration portal integrated with CBDT and GSTN database."
  },
  {
    "source_id": "SRC-DPIIT-001",
    "source_title": "DPIIT — Startup India Gazette Notifications & Recognition Portal",
    "issuing_authority": "Department for Promotion of Industry and Internal Trade (DPIIT)",
    "official_url": "https://www.startupindia.gov.in/",
    "source_type": "OFFICIAL_PORTAL",
    "jurisdiction": "IN-CENTRAL",
    "publication_date": "2019-02-19",
    "accessed_date": "2026-10-17",
    "last_verified_at": "2026-10-17",
    "next_review_at": "2027-04-01",
    "reliability_classification": "PRIMARY_STATUTORY",
    "access_restrictions_notes": "Statutory recognition framework under Section 56(2)(viib) of the Income-tax Act."
  },
  {
    "source_id": "SRC-BAR-001",
    "source_title": "Bar Council of India — Advocates Act, 1961 Statutory Representation Framework",
    "issuing_authority": "Bar Council of India / Parliament of India",
    "official_url": "https://www.barcouncilofindia.org/",
    "source_type": "STATUTE",
    "jurisdiction": "IN-CENTRAL",
    "publication_date": "1961-05-19",
    "accessed_date": "2026-10-17",
    "last_verified_at": "2026-10-17",
    "next_review_at": "2027-04-01",
    "reliability_classification": "PRIMARY_STATUTORY",
    "access_restrictions_notes": "Statutory boundary governing legal representation in courts and tribunals. Confirms non-litigation corporate secretarial scope."
  },
  {
    "source_id": "SRC-INT-001",
    "source_title": "CraftEgon CCS Master Service Registry Decision Record CRAFTEGON-DOC-P2-002",
    "issuing_authority": "CraftEgon Corporate Services Executive Council & Technical Architecture Team",
    "official_url": "https://ccs.craftegon.com/review-output/phase-2-service-registry/phase-2-service-id-reconciliation-report.md",
    "source_type": "INTERNAL_APPROVAL_RECORD",
    "jurisdiction": "IN-CENTRAL",
    "publication_date": "2026-10-17",
    "accessed_date": "2026-10-17",
    "last_verified_at": "2026-10-17",
    "next_review_at": "2027-04-01",
    "reliability_classification": "INTERNAL_EXECUTIVE_RECORD",
    "access_restrictions_notes": "Authoritative internal decision register locking 57 routes, 54 active service IDs, and 3 referral-only boundaries."
  },
  {
    "source_id": "SRC-INT-PRC-001",
    "source_title": "CraftEgon CCS Captured Website Template Rates (Unverified Baseline)",
    "issuing_authority": "CraftEgon LLP Finance & Commercial Committee",
    "official_url": "https://ccs.craftegon.com/docs/product-blueprint/vertical-service-matrix.md",
    "source_type": "INTERNAL_COMMERCIAL_RECORD",
    "jurisdiction": "IN-CENTRAL",
    "publication_date": "2026-10-15",
    "accessed_date": "2026-10-17",
    "last_verified_at": null,
    "next_review_at": "2026-11-15",
    "reliability_classification": "INTERNAL_INDICATIVE_BASELINE",
    "access_restrictions_notes": "Captured indicative website template figures from Phase 1 HTML service pages, preserved as unverified historical baseline data. Not an authoritative professional fee quote or binding commercial offer."
  },
  {
    "source_id": "SRC-ACT-CA2013-S403",
    "source_title": "Companies Act, 2013 (Section 403) & Companies (Registration Offices and Fees) Rules, 2014 (Table of Additional Fees)",